0.0,973.8737182239931,The Epidemiology of Hip and Knee Primary and Revision Arthroplasties during the COVID-19 Pandemic.
0.0,933.2382972076542,Family Food Environment during the COVID-19 Pandemic: A Qualitative Study.
1.0,1183.326281700732,LUX: Smart Mirror with Sentiment Analysis for Mental Comfort.
1.0,1207.6470280740696,Tablet Use Affects Preschoolers' Executive Function: fNIRS Evidence from the Dimensional Change Card Sort Task.
0.0,1026.5741871752402,Decrease in Mobility during the COVID-19 Pandemic and Its Association with Increase in Depression among Older Adults: A Longitudinal Remote Mobility Monitoring Using a Wearable Sensor.
1.0,1161.9922640259265,ACE2 Is an Adjacent Element of Atherosclerosis and COVID-19 Pathogenesis.
0.0,1091.8094879233524,Computational Identification of Potential Anti-Inflammatory Natural Compounds Targeting the p38 Mitogen-Activated Protein Kinase (MAPK): Implications for COVID-19-Induced Cytokine Storm.
0.0,984.701259129235,"If There's Something Strange in Your Neighbourhood, Who You Gonna Call? Perceived Mental Health Service User Suitability for Video Consultations."
0.0,1098.709241105752,Telemonitoring in the Covid-19 Era: The Tuscany Region Experience.
0.0,994.9786818849634,"Professional Quality of Life, Engagement, and Self-Care in Healthcare Professionals in Ecuador during the COVID-19 Pandemic."
0.0,1008.2355001620072,Physical activity and medication in Brazilians suffering with non-communicable diseases in quarantine by COVID-19.
0.0,1013.061849999745,Mass testing-An underexplored strategy for COVID-19 control.
0.0,950.17082200035,Genetic correlations between COVID-19 and a variety of traits and diseases.
0.0,966.1851046263891,The Association of Subacute Thyroiditis with COVID-19: a Systematic Review.
0.0,1142.9590538122188,Therapeutic use of Guggulsterone in COVID-19 induced obesity (COVIBESITY) and significant role in immunomodulatory effect.
0.0,979.3362962570617,The COVID-19 vaccination.
0.0,931.1106823795733,"""A Systematic Review on Guidelines and Recommendations for Tracheostomy During COVID-19 Pandemic""."
0.0,1024.665600787691,The use of ICT by ESL teachers working with young learners during the early COVID-19 pandemic in Poland.
0.0,1005.9952282668994,"Correction to: "" Leads to Vicious Cycle of Infection, Coagulopathy and Cytokine Storm in COVID-19: Can Prophylactic Oxygen Therapy Prevent It?"
0.0,971.5100324616765,News Sentiment Informed Time-series Analyzing AI (SITALA) to curb the spread of COVID-19 in Houston.
0.0,975.4218217409775,Medical adherence in the time of social distancing: a brief report on the impact of the COVID-19 pandemic on adherence to treatment in patients with diabetes.
0.0,953.6102960724929,COVID-19: Perspectives From Frontline Critical Care Nurses in New York.
0.0,1017.0447526088725,The Dual Epidemics of 2020: Nursing Leaders' Reflections in the Context of Whole Person/Whole Systems.
0.0,1028.9069720727257,Evaluation of Nasal Mucociliary Clearance Time in COVID-19 Patients.
0.0,1051.0175030701396,Motor demyelinating tibial neuropathy in COVID-19.
0.0,1138.7751961367985,International perspectives on radiography practice education.
0.0,1116.7485975734776,The pig as a medical model for acquired respiratory diseases and dysfunctions: An immunological perspective.
0.0,1068.463086130558,Interruption of outpatient follow-up in physical and rehabilitation medicine: observational cross-sectional study of deleterious consequences of the first COVID-19 lockdown in France.
0.0,1058.4735454810827,Genetic polymorphisms as multi-biomarkers in severe acute respiratory syndrome (SARS) by coronavirus infection: A systematic review of candidate gene association studies.
1.0,1163.0750304824571,Reconstitution and functional characterization of SARS-CoV-2 proofreading complex.
0.0,1078.2376229843317,Endothelin Antagonism and Sodium Glucose Co-transporter 2 Inhibition A Potential Combination Therapeutic Strategy for COVID-19.
0.0,956.709176682445,COVID-19 Vaccination Prioritization Based on Cardiovascular Risk Factors and Number-Needed-to-Vaccinate to Prevent Death.
0.0,1132.819343902765,Promising role of defensins peptides as therapeutics to combat against viral infection.
0.0,917.3477763794017,Personalized prophylactic anticoagulation in hospitalized patients with Covid-19 - The role of anti-Xa monitoring.
0.0,931.130459334864,Early observations on the impact of a healthcare worker COVID-19 vaccination programme at a major UK tertiary centre.
0.0,1028.560360540342,"Seroprevalence of SARS-CoV-2 Antibodies in University Students: cross-sectional study, December 2020, England."
0.0,1039.0186989115589,Impact of COVID-19 pandemic on glycemic control among outpatients with type 2 diabetes in Japan: A hospital-based survey from a country without lockdown.
0.0,977.1931879436202,"Comments on: ""Low dose radiation therapy for severe COVID-19 pneumonia: a randomized double-blind study""."
0.0,1039.1305529617202,"[Breathing filters in hospital, COVID first-wave experience.]"
0.0,1109.8525437356286,"SARS-CoV-2 seroprevalence, and IgG concentration and pseudovirus neutralising antibody titres after infection, compared by HIV status: a matched case-control observational study."
0.0,917.9832555317831,Revamping the ever-changing landscape of drug development processes in the midst of COVID-19 pandemic.
0.0,1048.9331625872092,Mitigation effect of face shield to reduce SARS-CoV-2 airborne transmission risk: Preliminary simulations based on computed tomography.
0.0,1126.3004100149963,Biomedical applications of environmental friendly poly-hydroxyalkanoates.
0.0,1114.3537147500738,Factors associated with successful implementation of telehealth abortion in 4 United States clinical practice settings.
0.0,1116.493910693458,SARS-CoV-2 RNA: Exclusive friends and common foes.
1.0,1163.0745136236749,The power of parent scientists.
0.0,1007.1242701710851,Stress and anxiety among dental practitioners during the COVID-19 pandemic: A cross-sectional survey.
0.0,932.3310625985046,Donor Lung Evaluation and Lung Transplantation in the COVID-19 Era.
0.0,940.5419047239084,COVID-19 in a Lung Transplant Patient: Rapid Progressive Chronic Lung Allograft Dysfunction.
0.0,1095.8298168760032,Deep vein thrombosis more than two weeks after vaccination against COVID-19.
0.0,914.9853672997554,COVID-19: vaccination problems.
0.0,1004.1010960150751,New perspectives on natural flavonoids on COVID-19-induced lung injuries.
1.0,1241.0847170323216,Replicability of studies following a dual-criterion design.
0.0,1137.2002727890142,Assessing vaccine durability in randomized trials following placebo crossover.
0.0,940.2571599659994,Clinical course and care requirements during the 2020 COVID-19 epidemic in South Australia.
0.0,928.6032881759319,COVID-19 infection in patients with severe aplastic anaemia.
0.0,1001.0683032948345,Exploring the Relationships Between Resilience and News Monitoring with COVID Distress in Health Profession Students.
0.0,1070.01190043946,"A Response to: Letter to the Editor Regarding Combination of Tocilizumab and Steroids to Improve Mortality in Patients with Severe COVID-19 Infection: A Spanish, Multicenter, Cohort."
0.0,923.3746653265418,A review on the immune responses against novel emerging coronavirus (SARS-CoV-2).
1.0,1178.7494805496763,Bridging the Radiotherapy Education Gap in Africa: Lessons Learnt from the Cape Town Access to Care Training Programme Over the Past 5 Years (2015-2019).
0.0,922.6338511618708,Impact of COVID-19 on the outcomes of gastrointestinal surgery.
1.0,1179.0716025347328,"H, C, N and P chemical shift assignment for stem-loop 4 from the 5'-UTR of SARS-CoV-2."
0.0,978.1423696009364,Coronavirus disease 2019 (COVID-19) vaccination in systemic lupus erythematosus and anti-neutrophil cytoplasmic antibody-associated vasculitis.
0.0,950.6444739089447,Critical analysis of acute kidney injury in pediatric COVID-19 patients in the intensive care unit.
0.0,1118.4242603685445,Older Adults' Loneliness in Early COVID-19 Social Distancing: Implications of Rurality.
0.0,968.8633908555588,COVID-19 vaccine and blood clotting.
0.0,988.9710386220221,Will SARS-CoV-2 variants of concern affect the promise of vaccines?
1.0,1245.6116423586623,A rotationally focused flow (RFF) microfluidic biosensor by density difference for early-stage detectable diagnosis.
0.0,934.3410885923348,U-survival for prognostic prediction of disease progression and mortality of patients with COVID-19.
1.0,1215.5138931367326,The dimer-monomer equilibrium of SARS-CoV-2 main protease is affected by small molecule inhibitors.
0.0,1041.0596149589292,Towards computer-aided severity assessment via deep neural networks for geographic and opacity extent scoring of SARS-CoV-2 chest X-rays.
0.0,1020.9493220654225,"OxCOVID19 Database, a multimodal data repository for better understanding the global impact of COVID-19."
0.0,933.7872510133873,Fleeing lockdown and its impact on the size of epidemic outbreaks in the source and target regions - a COVID-19 lesson.
0.0,1025.5577723914048,"COVID-CT-MD, COVID-19 computed tomography scan dataset applicable in machine learning and deep learning."
0.0,1079.373206850004,Influence of the Peltzman effect on the recurrent COVID-19 waves in Europe.
0.0,999.6796772046523,Household COVID-19 risk and in-person schooling.
0.0,1140.9504354772796,Pulmonary fibrosis 4 months after COVID-19 is associated with severity of illness and blood leucocyte telomere length.
0.0,936.4667006619094,Evolving role of the hospice day centre during the COVID-19 pandemic.
0.0,930.8841805931587,Advanced cancer and COVID-19 comorbidity: medical oncology-palliative medicine ethics meetings in a comprehensive cancer centre.
0.0,1036.460261797302,SARS-CoV-2 Vaccine Acceptability in Patients on Hemodialysis: A Nationwide Survey.
1.0,1197.9344339162387,Sex differences in the induction of angiotensin converting enzyme 2 (ACE-2) in mouse lungs after e-cigarette vapor exposure and its relevance to COVID-19.
0.0,940.5296587102592,Delivering cervical cancer screening during the COVID-19 emergency.
0.0,1070.3865874147134,Covid-19: Booster vaccine to be rolled out in autumn as UK secures 60m more Pfizer doses.
0.0,957.9931039157304,We need clinical guidelines fit for a pandemic.
0.0,1003.0021691869205,Covid-19: US relaxes rules on mask wearing for fully vaccinated people.
0.0,973.3452716209574,"Was enough, and is enough, being done to protect the primary care workforce from COVID-19?"
0.0,887.633356665396,Suicide prevention and COVID-19: the role of primary care during the pandemic and beyond.
0.0,931.4910069996974,Bereavement care during and after the COVID-19 pandemic.
0.0,924.1780743716591,Covid-19: Heavy use of oxygen brings new danger to world's hospitals.
0.0,1065.125410086599,Psychological distress and associated factors of the primary caregivers of offspring with eating disorder during the coronavirus disease 2019 pandemic.
0.0,1029.315137635254,The impact of theory-based messages on COVID-19 vaccination intentions: a structured summary of a study protocol for a randomised controlled trial.
0.0,1107.298927791496,SARS-CoV-2 interacts with platelets and megakaryocytes via ACE2-independent mechanism.
0.0,964.0646028101233,Ethical considerations and patient safety concerns for cancelling non-urgent surgeries during the COVID-19 pandemic: a review.
0.0,1123.1851874241236,"Research priority-setting for human, plant, and animal virology: an online experience for the Virology Institute of the Philippines."
0.0,1030.9423513006634,"Shaping applied epidemiology workforce training to strengthen emergency response: a global survey of applied epidemiologists, 2019-2020."
0.0,992.7127811689634,Examining the diffusion of coronavirus disease 2019 cases in a metropolis: a space syntax approach.
0.0,1062.7141970815248,Impacts of the 2008 Great Recession on dietary intake: a systematic review and meta-analysis.
0.0,829.7096612162833,Challenges and opportunities from the COVID-19 pandemic in medical education: a qualitative study.
1.0,1271.2165281187742,Smartpath: a platform for teaching glomerulopathies using machine learning.
0.0,896.6956170963834,Effectiveness of personal protective health behaviour against COVID-19.
0.0,890.8229381538359,Does lock-down of Wuhan effectively restrict early geographic spread of novel coronavirus epidemic during chunyun in China? A spatial model study.
0.0,997.4227293090155,Recovery of new-onset kidney disease in COVID-19 patients discharged from hospital.
0.0,1081.384769902086,Clinical characteristics of SARS-CoV-2 pneumonia diagnosed in a primary care practice in Madrid (Spain).
0.0,1137.2504154337112,Risk factors for secondary hemophagocytic lymphohistiocytosis in severe coronavirus disease 2019 adult patients.
0.0,1004.1355062525536,The Utility of the Pandemic Grief Scale in Identifying Functional Impairment from COVID-19 Bereavement.
0.0,1019.9109958155991,"Anti-Immigrant Rhetoric, Deteriorating Health Access, and COVID-19 in the Rio Grande Valley, Texas."
0.0,1130.31480010682,Potential Use of College of American Pathologists Accredited Biorepositories to Bridge Unmet Need for Medical Refrigeration Using Ultralow Temperature Storage for COVID-19 Vaccine or Drug Storage.
0.0,975.7836853398043,"Association between cardiovascular disease, cardiovascular drug therapy, and in-hospital outcomes in patients with COVID-19: data from a large single-center registry in Poland."
1.0,1226.1252233412895,Recurrent topic-transition gan for visual paragraph generation.
1.0,1294.6689709452278,Modelling one‐and two‐dimensional solid‐state NMR spectra 
1.0,1290.0991989612387,Storygan: A sequential conditional gan for story visualization
1.0,1272.3456654907056,Attngan: Fine-grained text to image generation with attentional generative adversarial networks
1.0,1239.4611028741701,A perpendicular-anisotropy CoFeB–MgO magnetic tunnel junction
1.0,1225.811099054029,Tidal ventilation at low airway pressures can augment lung injury.
